id 1,name 1,id 2,name 2,short_lyric 1,lyric 1,lyric 2
64299,HÃY N I,53004,hãy bên nhau,CẦN NHỮNG GÓC VẮNG CHO LÒNG YÊN LẮNG NƯỚC MẮT...,"",HÃY BÊN NHAU NHỮNG LÚC ĐÓI NGHÈO HÃY CHIA NHAU NHỮNG KHI GIÀU SANG HÃY YÊU NHAU NHƯ PHÚT BAN ĐẦU VÌ CUỘC ĐỜI CHẲNG CÓ BAO LÂU HÃY YÊU THƯƠNG NHỮNG BẤT HẠNH HÃY CHIA NHAU LÚC LẦM THAN HÃY BÊN NHAU NHỮNG LÚC THẤP HÈN VÌ CUỘC ĐỜI SỐNG CÓ LÀ BAO NÀY ANH NHỚ RẰNG MÌNH CÙNG MỘT CỘI MÀ RA NÀY EM NHỚ RẰNG MÌNH CÙNG LÀ MỘT MÀU DA HÃY CHO NHAU NỒNG NÀN NHỮNG TIN YÊU NGẬP TRÀN ĐỂ MAI SAU GẶP LẠI NHAU CÒN MÃI THƯƠNG NHAU NÀY ANH NHỚ RẰNG MÌNH CÙNG MỘT MẸ MÀ THÔI VÀ EM BIẾT KHÔNG ĐỜI NGƯỜI RỒI CŨNG LẶNG TRÔI HÃY YÊU NHAU THẬT LÒNG HÃY THƯƠNG NHAU THẬT LÒNG ĐỂ MỘT MAI GẶP LẠI NHAU TÌNH KHÔNG PHAI MÀU HÃY BÊN NHAU NHỮNG LÚC ĐÓI NGHÈO HÃY CHIA NHAU NHỮNG KHI GIÀU SANG HÃY YÊU NHAU NHƯ PHÚT BAN ĐẦU VÌ CUỘC ĐỜI CHẲNG CÓ BAO LÂU HÃY YÊU THƯƠNG NHỮNG BẤT HẠNH HÃY CHIA NHAU LÚC LẦM THAN HÃY BÊN NHAU NHỮNG LÚC THẤP HÈN VÌ CUỘC ĐỜI SỐNG CÓ LÀ BAO NÀY ANH NHỚ RẰNG MÌNH CÙNG MỘT CỘI MÀ RA NÀY EM NHỚ RẰNG MÌNH CÙNG LÀ MỘT MÀU DA HÃY CHO NHAU NỒNG NÀN NHỮNG TIN YÊU NGẬP TRÀN ĐỂ MAI SAU GẶP LẠI NHAU CÒN MÃI THƯƠNG NHAU NÀY ANH NHỚ RẰNG MÌNH CÙNG MỘT MẸ MÀ THÔI VÀ EM BIẾT KHÔNG ĐỜI NGƯỜI RỒI CŨNG LẶNG TRÔI HÃY YÊU NHAU THẬT LÒNG HÃY THƯƠNG NHAU THẬT LÒNG ĐỂ MỘT MAI GẶP LẠI NHAU TÌNH KHÔNG PHAI MÀU ĐỂ MỘT MAI GẶP LẠI NHAU TÌNH KHÔNG PHAI MÀU.
61872,GIẤC MƠ M A HÈ,57029,giấc mơ,MÙA HÈ BƯỚC ĐI TRÊN ĐƯỜNG HÒA MÌNH CÙNG VỚI CÂY VÀ GIÓ...,"",NẾU NHƯ THỜI GIAN QUAY LẠI TRỞ VỀ NHỮNG NGÀY XƯA NẾU NHƯ ĐỂ CHO ANH TÌM LẠI ĐƯỢC MỘT TÌNH YÊU ĐÃ QUA NHIỀU NĂM DÀI TRONG HOANG MANG HOÀI NGHI ANH CỐ QUÊN ĐI TÌNH YÊU LÀ EM MỘT NGÀY MƯA NHẸ RƠI NƠI MÀ CON PHỐ VẮNG ANH NHẬN RA GƯƠNG MẶT MANG CHO ANH BAO CẢM GIÁC THÂN QUEN MÀ BÀN TAY NGƯỜI NHẸ CẦM BÀN TAY KHÁC ĐỂ LẠI ANH TIM RUN RUN MÃI TRÔNG NGÓNG THEO QUA TỪNG LỐI ĐI CƠN MƯA KIA VẪN RƠI NHIỀU XOA DỊU NỖI ĐAU TRONG TÂM TƯ BIẾT BAO ĐIỀU SAO TỈNH GIẤC MƠ KHI BAO NHIÊU NGHĨ SUY VẪN NGẬP TRÀN U MÊ MỘT LỐI ĐI MỜ XA ĐỂ RỒI GIÂY PHÚT MÌNH VƯỢT QUA NHAU LÀ MỘT CẢM GIÁC CHẲNG THỂ NÀO QUÊN LẶNG NHÌN THEO GIẤC MƠ ĐÃ CUỐN ĐI VỀ MỘT NƠI XA NẾU NHƯ THỜI GIAN QUAY LẠI TRỞ VỀ NHỮNG NGÀY XƯA NẾU NHƯ ĐỂ CHO ANH TÌM LẠI ĐƯỢC MỘT TÌNH YÊU ĐÃ QUA NHIỀU NĂM DÀI TRONG HOANG MANG HOÀI NGHI ANH CỐ QUÊN ĐI TÌNH YÊU LÀ EM MỘT NGÀY MƯA NHẸ RƠI NƠI MÀ CON PHỐ VẮNG ANH NHẬN RA GƯƠNG MẶT MANG CHO ANH BAO CẢM GIÁC THÂN QUEN MÀ BÀN TAY NGƯỜI NHẸ CẦM BÀN TAY KHÁC ĐỂ LẠI ANH TIM RUN RUN MÃI TRÔNG NGÓNG THEO QUA TỪNG LỐI ĐI CƠN MƯA KIA VẪN RƠI NHIỀU XOA DỊU NỖI ĐAU TRONG TÂM TƯ BIẾT BAO ĐIỀU SAO TỈNH GIẤC MƠ KHI BAO NHIÊU NGHĨ SUY VẪN NGẬP TRÀN U MÊ MỘT LỐI ĐI MỜ XA ĐỂ RỒI GIÂY PHÚT MÌNH VƯỢT QUA NHAU LÀ MỘT CẢM GIÁC CHẲNG THỂ NÀO QUÊN LẶNG NHÌN THEO GIẤC MƠ ĐÃ CUỐN ĐI VỀ MỘT NƠI XA YEAH TRÔI VÀO CƠN MƯA LÀ ANH NGÀY XƯA ĐÃ KHÔNG ĐI THEO EM NAY CÒN ĐÂU NỮA CHỈ CÒN ANH ĐÂY ĐÔI MI LẠI CAY YÊU EM ANH CỐ VƯỢT QUA THÁNG NGÀY CON TIM ANH ĐAU NGÀY MÌNH XA NHAU LÀ MỘT NỖI ÁM ẢNH HAY DÀI LÂU CHIA TAY CHIA TAY THÌ MÌNH CHIA TAY GIẤC MƠ RỒI CŨNG CHỈ LÀ TAN VỠ CÒN NHỚ NGÀY NÀO EM ĐÃ BÊN ANH EM YÊU ĐÃ NÓI RẰNG TÌNH YÊU ANH TRAO CHO EM CÓ PHẢI THẬT SỰ ĐIỀU ĐÓ LÀ QUÁ NHIỀU RỒI THÌ KHÔNG YÊU NHƯNG CÒN NHIỀU ĐIỀU CHẲNG LẼ EM MUỐN EM KHỔ VẬY SAO YOU MAKE ME CRY YOU MAKE ME SMILE YOU WANT SAY GOODBYE QUA TỪNG LỐI ĐI CƠN MƯA KIA VẪN RƠI NHIỀU XOA DỊU NỖI ĐAU TRONG TÂM TƯ BIẾT BAO ĐIỀU SAO TỈNH GIẤC MƠ KHI BAO NHIÊU NGHĨ SUY VẪN NGẬP TRÀN U MÊ MỘT LỐI ĐI MỜ XA ĐỂ RỒI GIÂY PHÚT MÌNH VƯỢT QUA NHAU LÀ MỘT CẢM GIÁC CHẲNG THỂ NÀO QUÊN LẶNG NHÌN THEO GIẤC MƠ ĐÃ CUỐN ĐI VỀ MỘT NƠI XA.
61985,GIỮ TỪNG GIẤC MƠ,57029,giấc mơ,ĐÊM SÁNG LUNG LINH MUÔN NGÀN VÌ SAO LẤP LÁNH...,"",NẾU NHƯ THỜI GIAN QUAY LẠI TRỞ VỀ NHỮNG NGÀY XƯA NẾU NHƯ ĐỂ CHO ANH TÌM LẠI ĐƯỢC MỘT TÌNH YÊU ĐÃ QUA NHIỀU NĂM DÀI TRONG HOANG MANG HOÀI NGHI ANH CỐ QUÊN ĐI TÌNH YÊU LÀ EM MỘT NGÀY MƯA NHẸ RƠI NƠI MÀ CON PHỐ VẮNG ANH NHẬN RA GƯƠNG MẶT MANG CHO ANH BAO CẢM GIÁC THÂN QUEN MÀ BÀN TAY NGƯỜI NHẸ CẦM BÀN TAY KHÁC ĐỂ LẠI ANH TIM RUN RUN MÃI TRÔNG NGÓNG THEO QUA TỪNG LỐI ĐI CƠN MƯA KIA VẪN RƠI NHIỀU XOA DỊU NỖI ĐAU TRONG TÂM TƯ BIẾT BAO ĐIỀU SAO TỈNH GIẤC MƠ KHI BAO NHIÊU NGHĨ SUY VẪN NGẬP TRÀN U MÊ MỘT LỐI ĐI MỜ XA ĐỂ RỒI GIÂY PHÚT MÌNH VƯỢT QUA NHAU LÀ MỘT CẢM GIÁC CHẲNG THỂ NÀO QUÊN LẶNG NHÌN THEO GIẤC MƠ ĐÃ CUỐN ĐI VỀ MỘT NƠI XA NẾU NHƯ THỜI GIAN QUAY LẠI TRỞ VỀ NHỮNG NGÀY XƯA NẾU NHƯ ĐỂ CHO ANH TÌM LẠI ĐƯỢC MỘT TÌNH YÊU ĐÃ QUA NHIỀU NĂM DÀI TRONG HOANG MANG HOÀI NGHI ANH CỐ QUÊN ĐI TÌNH YÊU LÀ EM MỘT NGÀY MƯA NHẸ RƠI NƠI MÀ CON PHỐ VẮNG ANH NHẬN RA GƯƠNG MẶT MANG CHO ANH BAO CẢM GIÁC THÂN QUEN MÀ BÀN TAY NGƯỜI NHẸ CẦM BÀN TAY KHÁC ĐỂ LẠI ANH TIM RUN RUN MÃI TRÔNG NGÓNG THEO QUA TỪNG LỐI ĐI CƠN MƯA KIA VẪN RƠI NHIỀU XOA DỊU NỖI ĐAU TRONG TÂM TƯ BIẾT BAO ĐIỀU SAO TỈNH GIẤC MƠ KHI BAO NHIÊU NGHĨ SUY VẪN NGẬP TRÀN U MÊ MỘT LỐI ĐI MỜ XA ĐỂ RỒI GIÂY PHÚT MÌNH VƯỢT QUA NHAU LÀ MỘT CẢM GIÁC CHẲNG THỂ NÀO QUÊN LẶNG NHÌN THEO GIẤC MƠ ĐÃ CUỐN ĐI VỀ MỘT NƠI XA YEAH TRÔI VÀO CƠN MƯA LÀ ANH NGÀY XƯA ĐÃ KHÔNG ĐI THEO EM NAY CÒN ĐÂU NỮA CHỈ CÒN ANH ĐÂY ĐÔI MI LẠI CAY YÊU EM ANH CỐ VƯỢT QUA THÁNG NGÀY CON TIM ANH ĐAU NGÀY MÌNH XA NHAU LÀ MỘT NỖI ÁM ẢNH HAY DÀI LÂU CHIA TAY CHIA TAY THÌ MÌNH CHIA TAY GIẤC MƠ RỒI CŨNG CHỈ LÀ TAN VỠ CÒN NHỚ NGÀY NÀO EM ĐÃ BÊN ANH EM YÊU ĐÃ NÓI RẰNG TÌNH YÊU ANH TRAO CHO EM CÓ PHẢI THẬT SỰ ĐIỀU ĐÓ LÀ QUÁ NHIỀU RỒI THÌ KHÔNG YÊU NHƯNG CÒN NHIỀU ĐIỀU CHẲNG LẼ EM MUỐN EM KHỔ VẬY SAO YOU MAKE ME CRY YOU MAKE ME SMILE YOU WANT SAY GOODBYE QUA TỪNG LỐI ĐI CƠN MƯA KIA VẪN RƠI NHIỀU XOA DỊU NỖI ĐAU TRONG TÂM TƯ BIẾT BAO ĐIỀU SAO TỈNH GIẤC MƠ KHI BAO NHIÊU NGHĨ SUY VẪN NGẬP TRÀN U MÊ MỘT LỐI ĐI MỜ XA ĐỂ RỒI GIÂY PHÚT MÌNH VƯỢT QUA NHAU LÀ MỘT CẢM GIÁC CHẲNG THỂ NÀO QUÊN LẶNG NHÌN THEO GIẤC MƠ ĐÃ CUỐN ĐI VỀ MỘT NƠI XA.
61763,EM MÃI LÀ NGƯỜI TÌNH,56772,mãi chỉ là người tình,NGỌT NGÀO ĐÔI MÔI CHO EM NHỮNG BUỒN VUI...,"","MỘT NGÀY ĐÃ TRÔI QUA NHANH. MỘT NGÀY KHÔNG TRĂNG, KHÔNG SAO. MỘT NGÀY KHÔNG CÓ ÁNH SÁNG SOI TÂM HỒN ANH. MỘT NGÀY KHI EM XA ANH. MỘT NGÀY TA CHIA TAY NHAU. MỘT NGÀY ĐÃ BIẾT TRƯỚC SẼ LÀ NHƯ THẾ. NGƯỜI TÌNH ƠI ANH YÊU EM. NGƯỜI TÌNH ƠI ANH MONG EM. MÀ TẠI SAO TA VẪN MÃI SỐNG XA RỜI NHAU. MỘT NGÀY CHO NHAU YÊN VUI. RỒI LẠI CHIA TAY NHAU THÔI. ĐƯỜNG TÌNH TA ĐÃ KHÔNG SAO TÌM RA LỐI. . MÃI MÃI CHỈ LÀ NGƯỜI TÌNH TA KHÔNG THỂ ĐẾN VỚI NHAU. CỐ GẮNG THÌ CUỘC TÌNH MÌNH CŨNG CHẲNG THỂ ĐI ĐẾN ĐÂU. NÊN THÔI ĐÀNH LÒNG NGUYỆN CẦU NHÌN EM HẠNH PHÚC CẤT BƯỚC RA ĐI. MÃI MÃI CHỈ LÀ NGƯỜI TÌNH Ở MỘT NƠI XA RẤT XA. LÂU LÂU GẶP MẶT ĐỂ RỒI TIM TA LẠI THẤY NHÓI ĐAU. CÓ LẼ MÌNH ĐÀNH NGẬM NGÙI QUÊN ĐI MONG ƯỚC HẠNH PHÚC XA VỜI."
60470,BUỒN TẢ TƠI,56945,buồn ơi,NGÀY NÀO CÒN ĐÂY EM BƯỚC ĐI CÙNG TÔI THÁNG NGÀY TRÔI...,"","BUỒN ƠI! GIỜ MI ĐANG Ở CHÂN TRỜI NAO, NGƯỜI TA YÊU THƯƠNG CŨNG ĐÃ LÌA XA. CHẲNG THIẾT THA...!. BUỒN ƠI! TÌNH YÊU LÀ CHI CỚ SAO NGƯỜI ĐI, NGƯỜI MANG TÌNH TA VỀ NƠI XA LẮM VỚI GIẤC MƠ THẦN TIÊN, GIỜ THÔI BAO MỘNG MƠ ĐÃ VỠ RỒI.... HÃY ĐẾN CHO TA SẦU VƠI QUÊN ĐI BAO NỖI NHỚ. HÃY ĐẾN CHO TA GĂP MI XUA TAN ĐI BÓNG ĐÊM. BUỒN HÃY ĐẾN ĐÂY CHO TA CHUYỆN TRÒ, MONG GẶP MI ĐỂ SẦU KIA TAN ĐI. HÃY ĐẾN CHO TA TÌNH YÊU NƠI CON TIM BÉ NHỎ. HÃY ĐẾN VÂY QUANH ĐỜI TA KHI TA ĐÃ MẤT EM. BUỒN HÃY ĐẾN ĐÂY CHO TA BIẾT RẰNG. KHI NGƯỜI TA YÊU THƯƠNG ĐÃ RỜI XA...TA VẪN CÒN MI!"
60524,CẢM GIÁC LẠ,55237,cảm giác lạ,TỪ NGÀY GẶP EM CẢM GIÁC TRONG ANH RẤT LẠ...,"","CẢM GIÁC LẠ, EM CỐ QUÊN ANH, CHÔN BÓNG HÌNH ANH Ở TRONG ĐÁY TIM.. CẢM GIÁC LẠ, DẤU BIẾT ĐẮNG CAY, CÓ ĐẾN ĐƯỢC ĐÂU, MÀ SAO EM VẪN YÊU.. TỪ NGÀY ANH ĐẾN, 2 CHÚNG TA CỨ XEM NHƯ LÀ, MÌNH CHỈ ĐÙA VUI KHÔNG CÓ TÌNH YÊU, VẬY MÀ GIỜ ĐÂY NHỚ ANH MẮT MÔI NỤ CƯỜI, CÀNG CỐ XA TA CÀNG GẦN.. DÙ NGUYỆN TRONG TIM SẼ KHÔNG ĐẮM TRONG MƯA TÌNH. SỢ TÌNH YÊU NHƯ BÃO GIÔNG,LẠ THẬT BÊN ANH THẤY NHƯ ĐÃ QUEN KIẾP NÀO, BÀNG HOÀNG EM BIẾT MÌNH ĐANG YÊU.. CẢM GIÁC LẠ, EM CỐ QUÊN ANH, CHÔN BÓNG HÌNH ANH Ở TRONG ĐÁY TIM.. CẢM GIÁC LẠ, DẤU BIẾT ĐẮNG CAY, CÓ ĐẾN ĐƯỢC ĐÂU, MÀ SAO EM VẪN YÊU."
62736,LỜI N I TỪ TRÁI TIM,52043,lời nói từ trái tim,XIN ĐẶT BÀN TAY KHẼ LÊN TRÊN NGỰC ANH VÀ RỒI...,"",KHI ĐI BÊN EM TAY TRONG TAY VU VƠ LANG THANG TRONG ĐÊM...SAY SƯA TRĂNG LÊN NHƯ PHIÊU LƯU BAY THEO TRÊN CAO XEM ĐÔI TA TRAO NHAU MÔI HÔN RIÊNG CON TIM ANH MONG SAO CHÂN TÌNH KHÔNG SỜN XIN TRĂNG ĐÊM NAY SOI NƠI ANH EM ƠI NGHE KHÔNG TRÊN CAO YÊU THƯƠNG MÊNH MÔNG NHƯ SAO XIN DÀNH TRAO NGƯỜI CHO ĐÊM NAY KHÔNG PHAI HƯƠNG MÔI ÊM TRÔI XIN BÊN ANH NGHE CON TIM ANH TỪ KHI ANH CHỢT BIẾT NẾU THIẾU VẮNG EM DẪU CHO MỘT PHÚT PHẢI NHỚ ĐẾN EM NHƯ ĐÊM VẮNG TRĂNG KHUYA MỘT MÌNH BAY THEO GIÓ CÔ ĐƠN LÀ THUYỀN NHẸ NHÀNG TRÔI GIỮA KHÔNG TRUNG LÀM ĐÔI MI CỨ RƯNG RƯNG.. ĐI TÌM EM !
62296,HỠI NGƯỜI TÌNH,50340,hỡi người tình lara,TRỜI VẪN CỨ MƯA MÃI CHO LÒNG EM RÃ RỜI CHỜ ANH...,"",NGƯỜI TÌNH THƯƠNG NHỚ HÃY LẮNG NGHE LỜI MẶN MÀ DÙ MÙA XUÂN ĐÃ CHÔN VÙI BỞI LÀN TUYẾT KIA NGỌN ĐỒI TRẮNG XÓA SẼ CÓ HOA MỌC ĐẦU MÙA MỘNG ĐẸP NHƯ CŨ ÂN TÌNH CÒN VỀ VỚI TA NGƯỜI YÊU! CHÚNG TA CÒN YÊU NHAU NHIỀU CÒN THEO MÙA XUÂN VÀO TÌNH YÊU TÌNH YÊU! NGƯỜI TÌNH SẼ ĐẾN NGƯỜI ĐẾN QUÊN CẢ LẠNH LÙNG VÀ NỤ HÔN ẤM NHƯ LÀ TỪNG LÀN TUYẾT HÔN CHỜ NGÀY SẼ TỚI TÌM ĐẾN BÊN NGƯỜI BẠN ĐỜI NGƯỜI YÊU HỠI NHỚ THƯƠNG ĐỜI ĐỜI CHỚ PHAI! NGƯỜI YÊU HỠI NHỚ THƯƠNG ĐỜI ĐỜI CHỚ PHAI!
65468,XIN NGƯỜI LÃNG QUÊN D M T I,56152,người thương nhớ người lãng quên,XIN EM ĐỪNG VỀ ĐÂY CHO TÔI ĐỚN ĐAU XIN EM HÃY QUÊN...,"",CHỈ CÒN LẠI DĨ VÃNG BÊN ĐỜI TÔI KHI ANH KHUẤT XA. CHỈ CÒN LẠI NƯỚC MẮT TRONG ĐÊM NHỚ THƯƠNG CHO CUỘC TÌNH ẤY. NHỚ LÚC ĐẮM ĐUỐI NỒNG NÀN TÌNH YÊU. CHỢT NGƯỜI RA ĐI XA KHUẤT NƠI CHÂN MÂY ĐỂ LẠI MỘT NỖI NHỚ CHO ĐỜI NHAU HẮT HIU. ĐÃ NHIỀU LẦN MUỐN NÓI NÓI MỘT CÂU XIN ANH THỨ THA. NHỮNG LỖI LẦM QUÁ KHỨ NHỮNG CÂU ĐẮNG CAY CHO TÌNH TAN VỠ. NƯỚC MẮT ĐÃ ƯỚT NHẠT NHÓA BÓNG ĐÊM NGƯỜI ĐÀNH QUAY LƯNG. QUÊN HẾT BAO CÂU THỀ ĐỂ MỘT NGƯỜI KHÓC THƯƠNG MỘT MÌNH. NGƯỜI THƯƠNG NHỚ NGƯỜI LÃNG QUÊN BƯỚC CHÂN ĐI LÒNG NGHE NÓI ĐAU. TỪNG ĐÊM TRẮNG NGỒI BÊN THỀM VẮNG MONG AI VỀ TÌM LẠI NGÀY XƯA. GIÓ HÃY ĐEM THƯƠNG NHỚ ĐẾN NGƯỜI DÙ XA RẤT XA. NÓI RẰNG TÔI ĐÃ KHÓC BAO ĐÊM VÌ NHỮNG LỖI LẦM. HÃY VỀ ĐI ANH NHÉ BÊN EM MỘT LẦN NỮA THÔI. ĐỂ RỒI TA MÃI MÃI KHÔNG BAO GIỜ XA CÁCH NHAU
63435,NGÀY THÁNG QUAY VỀ,57853,ngày ngày tháng tháng,TRỞ VỀ LẠI NƠI MÀ TA NGỠ NHƯ ĐÃ QUÊN RỒI NHỮNG PHÚT ĐẦU...,"",MỘT NGƯỜI CỐ GẮNG CỐ GẮNG TÌM MỘT NGƯỜI. MỘT NGƯỜI CỐ BƯỚC CỐ TRÁNH XA MỘT NGƯỜI. MỘT NGƯỜI CÔ ĐƠN NƠI XÓT XA NHIỀU HƠN. MỘT NGƯỜI CHẠY TRỐN CÓ NHỚ HAY ĐÃ QUÊN. NGÀY NGÀY THÁNG THÁNG ĐÃ QUÁ NHIỀU KỈ NIỆM. GIỜ GIỜ PHÚT PHÚT VẪN THẤY ĐÔNG ĐẦY THÊM. VẬY MÀ HÔM NAY NHỮNG PHÚT GIÂY THẦN TIÊN. NHIỀU ĐIỀU MÌNH CÓ NAY ĐÃ TAN BIẾN. BAO NHIÊU NĂM QUA CUỘC TÌNH MÌNH TƯỞNG CHẲNG THẤY PHÔI PHA. ANH KHÔNG TIN EM RỜI XA ANH BƯỚC THEO NGƯỜI LẠ. ANH KHÔNG TIN TA MỘT NGÀY RỒI CŨNG CÁCH XA. BỞI CON TIM ANH TRÓT TRAO EM NHIỀU QUÁ. NHƯNG NAY ANH TIN GIỜ MÌNH ĐÃ VẮNG BÓNG EM YÊU. EM ƠI KHÔNG EM ĐỜI ANH NHƯ THIẾU ĐI MỘT ĐIỀU. EM ƠI KHÔNG EM THÌ CÒN GÌ NỮA HỠI EM. VẮNG ĐI EM ĐỜI ANH ĐÃ KHỔ ĐAU THẬT NHIỀỤ
63583,NGƯỜI THẾ VAI,52540,người thầy,CHIA TAY NGƯỜI NÓI RA CÂU QUEN TÔI CHỈ VUI THÔI...,"","NGƯỜI THẦY, VẪN LẶNG LẼ ĐI VỀ SỚM TRƯA. TỪNG NGÀY, GIỌT MỒ HÔI RƠI ĐẦY TRANG GIẤY.. ĐỂ EM ĐẾN BẾN BỜ ƯỚC MƠ, RỒI NĂM THÁNG SÔNG DÀI GIÓ MƯA, CÀNH HOA TRẮNG, VẪN LUNG LINH TRONG VƯỜN XƯA.. NGƯỜI THẦY, VẪN LẶNG LẼ ĐI VỀ DƯỚI MƯA, DÒNG ĐỜI, TỪNG NGÀY QUA ÊM ĐỀM TRÔI MÃI, CHIỀU TRÊN PHỐ BAO NGƯỜI ĐÓN ĐƯA, DÒNG SÔNG VẮNG BÂY GIỜ GIÓ MƯA, CÒN AI NHỚ, AI QUÊN CON ĐÒ XƯA.. . DÙ NĂM THÁNG VÔ TÌNH TRÔI MÃI MÃI, CÓ HAY BAO MÙA LÁ RƠI.. THẦY ĐÃ ĐẾN NHƯ MUÔN NGÀN TIA NẮNG, SÁNG SOI BƯỚC EM TRONG CUỘC ĐỜI.. VẪN NHỚ NHỮNG KHI TRỜI MƯA RƠI, VẪN CHIẾC ÁO XƯA SỜN ĐÔI VAI, THẦY VẪN ĐI, BUỒN VUI, LẶNG LẼ.. DÙ NĂM THÁNG VÔ TÌNH TRÔI MÃI MÃI, TÓC XANH BÂY GIỜ ĐÃ PHAI, THẪY VẪN ĐỨNG BÊN SÂN TRƯỜNG NĂM ẤY, DÕI THEO BƯỚC EM BƯỚC EM TRONG CUỘC ĐỜI, DẪU ĐẾM HẾT SAO TRỜI ĐÊM NAY, DẪU ĐẾM HẾT LÁ MÙA THU RƠI, NHƯNG NGÀN NĂM, LÀM SAO EM ĐẾM HẾT CÔNG ƠN NGƯỜI THẦY.. THE END."
65756,CÁI C ĐI Đ N CƠN MƯA,55393,người đi tìm cơn mưa,CÁI CÒ CÁI CÒ ĐI ĐÓN MÀ CƠN MƯA ĐI ĐÓN CƠN MƯA...,"","LỜI CHIA TAY NHAU EM QUAY MẶT ĐI, CÒN MỖI ANH NGỒI DƯỚI HIÊN MỘT MÌNH NGẮM MƯA. LẤM TẤM NHỮNG HẠT MƯA, LẤM TẤM NHỮNG GIỌT NƯỚC MẮT VÔ HÌNH... CÒN NIỀM TIN ANH TRAO EM THÌ SAO? VÀ ƯỚC MƠ VỀ MÃI SAU NHIỀU ĐIỀU LỚN LAO?. CHỈ MẤT ĐI MỘT NGƯỜI, CÓ KHÓ KHĂN GÌ, MÀ LÒNG CÒN HOÀI BUỐT ĐAU... CƠN MƯA ĐI QUA, NGƯỜI BUÔNG TAY ANH NHẸ NHÀNG. YÊU THƯƠNG ĐI QUA, NGƯỜI XÓA KÝ ỨC PHAI NHÒA. VÌ MỘT CƠN MƯA, ANH ĐÃ ĐỨNG NƠI ĐÂY CHỜ EM. CÂU YÊU NĂM XƯA, GIỜ NGẬP TRONG MƯA GIÁ RÉT. ĐÔI MÔI THÂN QUEN, GIỜ GIÓ MANG ĐI ĐÂU RỒI. VÀ NGÀY MƯA SAU, KHÔNG CẦN AI NHẮC VẪN NHỚ ĐẾN HÔM NAY... NGƯỜI VẪN ĐI TÌM CƠN MƯA, QUEN NHAU XA NHAU. NGƯỜI VẪN ĐI TÌM HƠI ẤM CHO NHAU MỚI HÔM NÀO. CÓ LÚC THÈM BƯỚC DƯỚI MƯA CHO HÔM SAU NGÃ BỆNH, ĐỂ NGƯỜI DÙ CHIA TAY VẪN GHÉ THĂM. NGƯỜI VẪN ĐI TÌM CƠN MƯA, NƠI ĐÂU NƠI ĐÂU?. NGƯỜI VẪN LUÔN THUỘC VỀ EM YÊU EM ĐẾN BÂY GIỜ. VẪN NGÓNG CHỜ TỪ PHÍA SAU Ô CỬA NHỎ, MỘT BÓNG DÁNG AI SAU NHIỀU CÁCH XA, VỀ TRƯỚC SÂN NHÀ... "
60671,CHIA TAY CŨNG LÀ YÊU,58473,hay là chia tay,BÊN HIÊN TIẾNG MƯA NHẸ RƠI CHO TIM NHÓI ĐAU...,"","VẬY LÀ CHÚNG TA CHIA TAY NHAU. CÒN GÌ NỮA ĐÂU EM BƯỚC ĐI. VÀ NGƯỜI KHÓC CHI VÌ EM ĐÃ NÓI CHIA TAY MÀ. NGƯỜI CẦN PHẢI KHÓC CHÍNH LÀ ANH. RỒI THÌ MẤT ANH EM MỚI HIỂU ĐƯỢC. TÌNH YÊU CỦA ANH NHƯ THẾ NÀO. VÀ ANH SẼ KHÔNG NHƯ NGƯỜI TA NÓI YÊU EM NHIỀU. VÌ ANH CHỈ YÊU BẰNG CON TIM. VÀ CHỈ KHI EM MẤT ĐI ANH. THÌ EM MỚI HIỂU RA ANH YÊU EM NHIỀU LẮM ĐẤY. RỒI EM SẼ NHẬN THẤY NHỮNG THỨ XUNG QUANH. CHỈ LÀ THOÁNG QUA HAY CHÍNH ANH LÀ MÃI MÃI. VÀ ANH CŨNG SỢ LẮM KHI ANH MẤT ĐI EM. CÒN NỖI SỢ NÀO HƠN, KHI MẤT NGƯỜI YÊU THƯƠNG. NHƯNG KHÓ THỂ THAY ĐỔI KHI EM ĐÃ HẾT YÊU ANH. HAY LÀ CHÚNG TA CHIA TAY TỪ ĐÂY EM NHÉ?"
60755,CHÍN TẦNG MÂY,52776,mây chiều,EM GIỜ XA MÃI XA THẬT RỒI ANH VẪN MONG BƯỚC CHÂN EM VỀ...,"","CHIỀU XUỐNG LÁ KHÔ RƠI NGƯỜI ĐI ĐÃ KHÔNG QUAY LẠI NGOẠI ĐỨNG DÁNG LƯNG CONG MỘT CON ĐÒ QUA MẤY SÔNG NGOÀI KIA MÂY TRẮNG BAY MIỀN QUÊ NẮNG MƯA BAO NGÀY TÓC XANH BÂY GIỜ ĐÃ PHA THÊM MÀU MÂY NGÀY ĐÓ MÁI TRANH XIÊU TỪNG ĐÊM GIÓ MƯA TRÊN ĐỒNG MẸ ĐÃ BƯỚC SANG SÔNG NGOẠI NUÔI ĐÀN EM THÁNG NĂM NGOÀI KIA CÂY MÍA LAO BUỒN THIU XÁC XƠ BÊN RÀO BÓNG MÂY BAN CHIỀU LÀM SAO CHE BÃO GIÔNG Ơ, GIÓ LẠNH NGOÀI HIÊN, GIÓ GIẬT TỪNG CƠN BUỒN RƠI CHẲNG DÁM QUA ĐÂY MƯA, RỚT LẠNH NGOÀI HIÊN, MÁI NHÀ BÌNH YÊN DÒNG SÔNG SÓNG XÔ ĐÔI BỜ NHƯ TIẾNG NGOẠI ẦU Ơ ƠI TÓC NGOẠI NGÀY NAY TRẮNG TỰA MÀU MÂY ĐỜI CHƯA QUA HẾT GIAN NAN ƠI, GIÓ LẠNH TỪNG ĐÊM, DÁNG NGOẠI GẦY THÊM CHIỀU NAY LÁ RƠI BÊN THỀM, CAU TRẮNG RỤNG NGOÀI HIÊN"
65801,CÁNH DIỀU MƠ ƯỚC,58759,cánh diều chiều mưa,CÁNH DIỀU NO GIÓ CHIỀU HÈ MÊ SAY RỘNG TRANG SÁCH...,"",NGÀY XƯA CÒN BÉ TÔI ĐI TRÊN CON ĐƯỜNG ĐÊ. VÀ TÔI CÒN NHỚ MƯA BAY THEO NHỮNG CÁNH DIỀU. AI MANG THEO GIÓ ĐỂ NÂNG ĐÔI CÁNH DIỀU ƯỚC MƠ NGÀY MAI. SAU BAO NĂM THÁNG CON TIM TÔI VẪN CHỜ GIẤC MƠ ĐỪNG PHAI. GIỜ ĐÂY LẶNG LẼ TÔI ĐI LANG THANG MỘT MÌNH. LẦN THEO HÌNH BÓNG TÔI MƠ GIẤC MƠ NGÀY NAO. TÌM VỀ NGÀY XƯA TIẾNG GỌI CÁNH DIỀU. RỒI TỪNG NGÀY QUA VỚI BAO NGÓNG TRÔNG
66378,NGHE EM HÁT ĐOẠN TRƯỜNG KIỀU,58159,nghe em hát ở trường xa,TÔI CŨNG LÀ NGHỆ SĨ NƯỚC MẮT MỒ HÔI THẤM ĐƯỢM...,"",Ở HỘI LIM ANH NGHE EM HÁT . CÂU HÁT TRAO DUYÊN NGƯỜI ƠI NGƯỜI ỜI. NAY Ở TRƯỜNG SA NGHE TIẾNG HÁT EM . CÂU HÁT NGƯỜI ƠI NGƯỜI Ở ĐỪNG VỀ. TRƯỜNG SA MÊNH MÔNG BIỂN VÀ ẦM ÀO GIÓ CÁT . CÓ TIẾNG HÁT EM NGÂN VANG . TRƯỜNG SA ANH ĐỨNG GÁC CANH GIỮA TRỜI ĐẢO NHỎ . S ÓNG BẠCH ĐẰNG CÓ THỂ Ở TRƯỜNG SA . DÁNG QUÊ NHÀ XANH THẮM ĐẢO TRƯỜNG SA. TRƯỜNG SA NÚI ĐẢO QUÊ HƯƠNG. GẦM GÀO SÓNG DỮ ANH VẪN ĐỨNG NƠI ĐÂY. ĐỂ NGHE TIẾNG HÁT EM VANG GIỮA TRỜI ĐẢO NHỎ. THẤY TIẾNG QUÊ MÌNH TRONG TIẾNG HÁT EM
66404,PHẬN TƠ TẰM,51051,phận tơ tằm,MƯA RƠI CHO ĐỜI THÊM NHỚ THƯƠNG HẠT MƯA ƯỚT VAI...,"",NGƯỜI CÓ THƯƠNG THƯƠNG TÔI NGHỆ SĨ...THÌ ĐỪNG CÓ THƯƠNG NHƯ THƯƠNG HẠI ĐỜI .. VÀ ĐỪNG CÓ NGHE KHI THIÊN HẠ ĐỒN DÈM PHA TÔI KIẾP XƯỚNG CA .. NGƯỜI ĐẾN ĐÂY ĐÊM ĐÊM PHÒNG TRÀ . ĐỂ MỘT KIẾP HOA THƯƠNG YÊU MẶN MÀ .. TÔI XIN NGƯỜI NHÌN LÊN SÂN KHẤU HÃY NGHE TÔI BUÔNG LỜI CA .. RƯỢU NỒNG ĐÓ NGƯỜI ĐÃ SAY CHƯA . ÂN TÌNH NẦY SAO KHÔNG GẮN BÓ .. ĐỜI LÀ NHỮNG DÒNG NƯỚC VÔ TƯ . TA LẠI TÌM SÓNG ĐƯA DẠT BỜ .. NGƯỜI NGỒI ĐÓ CÒN CÓ NGHE TÔI . TÂM TÌNH ĐẦY VƯƠNG LÊN ĐẮM ĐUỐI .. NGƯỜI ĐỪNG TRÁCH MỘT KIẾP CẦM CA . PHONG CẦM NÀO KHÔNG MUỐN VƯƠNG CAO .. NGƯỜI NÓI ĐI NHỮNG TIM NGƯỜI NGHĨ . LÀM NGHỀ XƯỚNG CA TÔI MANG TỘI GÌ .. HỌA LÀ CÓ CHĂNG TÔI MANG TỘI NGHIỆP LÀM CHO NHÂN THẾ SAY MÊ .. NGƯỜI NÓI ĐI CHO TÔI MỘT LỜI . RẰNG NGHỀ XƯỚNG CA TÔI KHÔNG LẠC LOÀI .. TÔI ƯÓC NGUYỆN CỘNG TÂM TÔI MUỐN KIẾP THƯƠNG CHO ĐỜI VUI .. NGƯỜI NÓI ĐI CHO TÔI MỘT LỜI . RẰNG NGHỀ XƯỚNG CA TÔI KHÔNG LẠC LOÀI .. TÔI ƯỚC NGUYỆN TẬN TÂM TÔI MUỐN KIẾP THƯƠNG CHO ĐỜI VUI ...
65141,TIẾNG HÁT NHỮNG C GIÁO TRẺ,55128,tiếng gió hát,VÌ YÊU THƯƠNG HỌC TRÒ EM TÔ ĐẸP TỪNG TIẾNG NÓI...,"",TRỜI CAO DANG RỘNG NHÌN LÀN MÂY VÀ NHƯ ĐANG GỌI TÌNH YÊU TRONG MƠ VÀ CƠN GIÓ THOÁNG QUA LÀM BAY BAY TÓC EM LÀN GIÓ VÔ TƯ THẦM HÁT CÂU YÊU THƯƠNG NHÌN ANH EM NÓI TÌNH YÊU ĐÓ DÀNH CHO ANH VÀ EM SẼ NÓI NGƯỜI YÊU HỠI MÌNH LUÔN CÓ NHAU GIÓ HÁT RÌ RÀO NGÂN VANG LỜI CA NGẤT NGÂY LÀM BỜ CÁT TRẮNG XÔN XAO BIỂN CHIỀU SÓNG ÊM VÀ VẪN NÓI LỜI YÊU YÊU EM TÌNH YÊU KHÁT KHAO THẦM NHỜ CƠN GIÓ MANG THEO NỤ HÔN ĐẮM SAY CHO EM TRỜI CAO DANG RỘNG NHÌN LÀN MÂY VÀ NHƯ ĐANG GỌI TÌNH YÊU TRONG MƠ VÀ CƠN GIÓ THOÁNG QUA LÀM BAY BAY TÓC EM LÀN GIÓ VÔ TƯ THẦM HÁT CÂU YÊU THƯƠNG NHÌN ANH EM NÓI TÌNH YÊU ĐÓ DÀNH CHO ANH VÀ EM SẼ NÓI NGƯỜI YÊU HỠI MÌNH LUÔN CÓ NHAU GIÓ HÁT RÌ RÀO NGÂN VANG LỜI CA NGẤT NGÂY LÀM BỜ CÁT TRẮNG XÔN XAO BIỂN CHIỀU SÓNG ÊM VÀ VẪN NÓI LỜI YÊU YÊU EM TÌNH YÊU KHÁT KHAO THẦM NHỜ CƠN GIÓ MANG THEO NỤ HÔN ĐẮM SAY TRONG EM GIÓ HÁT RÌ RÀO NGÂN VANG LỜI CA NGẤT NGÂY LÀM BỜ CÁT TRẮNG XÔN XAO BIỂN CHIỀU SÓNG ÊM VÀ VẪN NÓI LỜI YÊU YÊU EM TÌNH YÊU KHÁT KHAO THẦM NHỜ CƠN GIÓ MANG THEO NỤ HÔN ĐẮM SAY TRONG EM.
63356,NGÀN LỜI YÊU EM,56078,gửi ngàn lời yêu,NÀY NGƯỜI TÌNH ƠI ANH YÊU EM THẬT LÒNG VẬY MÀ TẠI SAO...,"","CON ĐƯỜNG LÊN ĐÈN. CHIỀU BÂNG KHUÂNG TRÊN PHỐ DÀI. TỪNG ĐÀN CHIM BAY THEO NHAU VỀ CUỐI BẦU TRỜI. CÓ CHÚT CÔ ĐƠN NÀO VẪN ÂM THẦM LÃNG DU . TRONG ÁNH MẮT, CHỢT DÂNG LÊN BAO NỖI NIỀM. IM LẶNG ĐÊM VỀ, NGỌN ĐÈN KHUYA HIU HẮT MỜ. MỘT VÌ SAO RƠI ĐƠN CÔI NHƯ NỖI ĐỢI CHỜ. CÓ CHÚT CHƠI VƠI NÀO, DƯỚI BÊN THỀM CÓ MÂY. CHO KHÚC HÁT MANG BAO ƯU TƯ VỀ ĐÂY. Ở NƠI, PHƯƠNG TRỜI XA RẤT XA. EM CÓ BIẾT ĐÊM DÀI A ĐÃ QUA. KHI RIÊNG MÌNH, ANH THẦM ƯỚC TỪNG PHÍM MÔI MỀM. NỤ HÔN EM, MONG MANH DỊU ÊM.. NHỮNG NỤ HOA CÒN BUỒN XANH XAO TRÊN LỐI VỀ. LẶNG THẦM TRONG ĐÊM PHIÊU DU CÂU HÁT ĐỢI CHỜ. LẤP LÁNH ÁNH SAO RƠI, PHÍA CHÂN TRỜI RẤT XA. CHỢT TÌNH ANH, MANG BAO YÊU THƯƠNG GỬI ĐẾN E. . NGƯỜI YÊU, BÊN BỜ XA NGÚT NGÁT. TỪ SÂU TRÁI TIM NÀY, ANH NHỚ EM. ĐÃ BAO MÙA, BAO NGÀY NẮNG RỒI MƯA VƠI ĐẦY . TÌNH YÊU ANH TRAO EM MÃI KHÔNG PHAI. NGỲƠI YÊU ƠI, TRONG LÒG ANH NHỚ EM. DÙ NĂM THÁNG ANH VẪN MONG CHỜ EM. MONG MỘT NGÀY, ẤM NỒNG THẤM LÀN TÓC MÔI HÔN EM ĐÂY. CẦM TAY EM, SẼ MAÃ CHẲNG RỜI XA"
62878,MÃI MÃI NHƯ GIẤC MƠ,54809,như giấc mơ,TỪ NGÀY MÌNH MẤT NHAU THÌ EM ƠI HÃY TIN RẰNG...,"",NGƠ NGÁC NHÌN HẠT SƯƠNG TRẮNG LONG LANH VAI MỀM THẤY ANH CÙNG EM TUNG TĂNG TRÊN PHỐ DÀI LẮNG NGHE AI THÌ THẦM NGOÀI HIÊN VẮNG MƯA RƠI RƠI NHẸ CÓ NGHE CỎ HOA HÁT RẰNG EM ĐANG NHỚ ANH NHỚ ANH ĐI ĐI TRÊN ĐƯỜNG MÀ SAO QUÁ VỘI VÀNG CHÚNG TA XEM KÌA NGƯỜI EM QUÁ DỊU DÀNG ÔI XINH TƯƠI KÌA BỜ MÔI VỚI NỤ CƯỜI CHO ANH THẪN THỜ NHÌN EM ĐI TRÊN LỐI VẮNG VÀ NGỠ NHƯ EM ĐANG CƯỜI VUI BIẾT CHĂNG EM ĐANG MONG CHỜ TIẾNG NÓI LỜI YÊU EM NHIỀU ĐỢI CHỜ ANH TRONG ĐÊM VẮNG NHỚ ANH NGÔI SAO NÀO ĐÂY ĐẾN BÊN EM ĐANG RẤT GẦN HÔN NHẸ ĐÔI MÁ EM XINH AI THÌ THẦM NGOÀI HIÊN VẮNG MƯA RƠI RƠI NHẸ CÓ NGHE CỎ HOA HÁT RẰNG EM ĐANG NHỚ ANH NHỚ ANH ĐI ĐI TRÊN ĐƯỜNG MÀ SAO QUÁ VỘI VÀNG CHÚNG TA XEM KÌA NGƯỜI EM QUÁ DỊU DÀNG ÔI XINH TƯƠI KÌA BỜ MÔI VỚI NỤ CƯỜI CHO ANH THẪN THỜ NHÌN EM ĐI TRÊN LỐI VẮNG VÀ NGỠ NHƯ EM ĐANG CƯỜI VUI BIẾT CHĂNG EM ĐANG MONG CHỜ TIẾNG NÓI LỜI YÊU EM NHIỀU ĐỢI CHỜ ANH TRONG ĐÊM VẮNG VÀ NHỚ ANH NGÔI SAO NÀO ĐÂY ĐẾN BÊN EM ĐANG RẤT GẦN HÔN NHẸ ĐÔI MÁ EM XINH NHÌN EM ĐI TRÊN LỐI VẮNG VÀ NGỠ NHƯ EM ĐANG CƯỜI VUI BIẾT CHĂNG EM ĐANG MONG CHỜ TIẾNG NÓI LỜI YÊU EM NHIỀU ĐỢI CHỜ ANH TRONG ĐÊM VẮNG VÀ NHỚ ANH NGÔI SAO NÀO ĐÂY ĐẾN BÊN EM ĐANG RẤT GẦN HÔN NHẸ ĐÔI MÁ EM XINH HÔN NHẸ ĐÔI MÁ EM XINH.
