id 1,name 1,id 2,name 2,short_lyric 1,lyric 1,lyric 2
66240,ĐƯỜNG VÀO TIM,54976,đường về,GẦN NHAU KHOẢNH KHẮC CHO LÒNG ẤM ÊM...,"",ĐƯỜNG VỀ XA VỜI GIEO THƯƠNG NHỚ CHO LÒNG HỒN QUÊ LAI LÁNG KHI ÁNH CHIỀU RƠI. ĐÃ MẤY THU XƯA QUA RỒI KHI GIÓ SẦU ĐÔNG MANG VỀ LÒNG BUỒN MAN MÁC NIỀM NHỚ . TỪNG ĐÀN CHIM CHIỀU TAN TÁC BỐN PHƯƠNG TRỜI MIỀN XA XA VẮNG ĐÂU CHỐN CỐ HƯƠNG. KHÓI BIẾC HỒN QUÊ CHỨA CHAN TRÔNG MÃI ĐƯỜNG VỀ XA XÔI NHƯ NHẮC TÌNH SẦU LY HƯƠNG. XA KHUẤT SAU CHÂN TRỜI TỪNG ĐÀN CHIM ÉN NGƠ NGÁC BAY. TIẾNG SÁO QUÊ LƯNG TRỜI MỘT MÙA ĐÔNG TÔ THÊM MÀU NHỚ . KHẮP ĐÓ ĐÂY MỊT MÙNG MỘT CHIỀU TAN TÁC VỚI NHỚ NHUNG. XA CỐ HƯƠNG MUÔN TRÙNG CHIỀU ĐÔNG SƯƠNG XUỐNG LÒNG GIÁ BĂNG. CHIỀU NAY GIÓ RÉT KHIẾN LÒNG BÂNG KHUÂNG MANG SẦU LY HƯƠNG. BUỒN NGƠ NGÁC NGẮM CÁNH CHIM CHIỀU BAY TUNG KHẮP ĐÓ ĐÂY. NHƯ NHẮC TA TRÊN ĐƯỜNG VỀ . NGÀN TRE XA XA THEO GIÓ LAY. NƠI CỐ HƯƠNG XA VỜI ĐƯỜNG VỀ TÔ THẮM LÒNG NHỚ MONG.
64561,TIẾNG CUỐC GỌI ĐÊM,53489,tiếng cuốc gọi đêm,HÒ ƠI Ơ Ơ Ơ Ơ Ơ CON CHIM LẠC BẦY BƠ NGƠ BÁO NGÁO...,"",THƯƠNG EM ANH CÒN NẮNG MƯA DÃI DẦU. KHÓ NHỌC ANH GÁNH LẤY HAI VAI. ANH NHƯ THÂN CÒ HÉO HON TỪNG NGÀY. ĐỂ EM VUI ANH RÁNG ĐI CÀY. HAI TA VỢ CHỒNG ĐÃ BAO NĂM RỒI. ĐÃ TỪNG QUA BAO NỖI GIAN LAO. BAO NHIÊU NGỌT ĐẮNG HIẾN DÂNG CHO NGƯỜI. CÒN RIÊNG ANH CHÉN ĐẮNG CHO MÌNH. ĐÊM NÀO EM RA ĐI XÓM KHUYA IM LÌM TẮT ĐÈN. MÌNH ANH VỚI MÁI NHÀ TRANH. THƯƠNG HÀNG CAU BAO NĂM NẮNG MƯA ĐẠ NHIỀU. BÂY GIỜ XA EM LÁ KIA XA CÀNH. Ơ! EM NGHE CHẮNG CUỐC KÊU EM NGHE CHĂNG CUỐC KÊU. NỨC NỞ VỀ ĐÊM SAO MƯA CỨ RƠI RƠI MÃI VÔ TÌNH. AI BIẾT LÒNG NHAU AI BIẾT MÌNH ĐAU ĐÊM XUỐNG TỪ LÂU. THƯƠNG CON CUỐC ĐỨNG GỌI ĐỒNG SÂU. Ơ! ANH THƯƠNG EM BẤY LÂU. ANH THƯƠNG EM BẤY LÂU SAO NỞ CHIA LÌA. SAO ANH BỎ ĐI KHÔNG VẸN LỜI THỀ. TIẾNG CUỐC VỌNG ĐÊM NHƯ TRÁCH HỜN AI. ANH VẪN CÒN ĐÂY SAO EM NỞ LÒNG RỦ BỎ VÒNG TAY. HÒ ƠI... CON CHIM LẠC BẦY BƠ NGƠ BÁO NGÁO. CON GÀ LẠC MẸ LƠ LÁO CỬA CHUỒNG. CON CUỐC LẺ ĐÔI KHÓC GỌI ĐẦU TRUÔNGTHƯƠNG EM ANH CÒN NẮNG MƯA DÃI DẦU. KHÓ NHỌC ANH GÁNH LẤY HAI VAI. ANH NHƯ THÂN CÒ HÉO HON TỪNG NGÀY. ĐỂ EM VUI ANH RÁNG ĐI CÀY. HAI TA VỢ CHỒNG ĐÃ BAO NĂM RỒI. ĐÃ TỪNG QUA BAO NỖI GIAN LAO. BAO NHIÊU NGỌT ĐẮNG HIẾN DÂNG CHO NGƯỜI. CÒN RIÊNG ANH CHÉN ĐẮNG CHO MÌNH. ĐÊM NÀO EM RA ĐI XÓM KHUYA IM LÌM TẮT ĐÈN. MÌNH ANH VỚI MÁI NHÀ TRANH. THƯƠNG HÀNG CAU BAO NĂM NẮNG MƯA ĐẠ NHIỀU. BÂY GIỜ XA EM LÁ KIA XA CÀNH. Ơ! EM NGHE CHẮNG CUỐC KÊU EM NGHE CHĂNG CUỐC KÊU. NỨC NỞ VỀ ĐÊM SAO MƯA CỨ RƠI RƠI MÃI VÔ TÌNH. AI BIẾT LÒNG NHAU AI BIẾT MÌNH ĐAU ĐÊM XUỐNG TỪ LÂU. THƯƠNG CON CUỐC ĐỨNG GỌI ĐỒNG SÂU. Ơ! ANH THƯƠNG EM BẤY LÂU. ANH THƯƠNG EM BẤY LÂU SAO NỞ CHIA LÌA. SAO ANH BỎ ĐI KHÔNG VẸN LỜI THỀ. TIẾNG CUỐC VỌNG ĐÊM NHƯ TRÁCH HỜN AI. ANH VẪN CÒN ĐÂY SAO EM NỞ LÒNG RỦ BỎ VÒNG TAY. HÒ ƠI... CON CHIM LẠC BẦY BƠ NGƠ BÁO NGÁO. CON GÀ LẠC MẸ LƠ LÁO CỬA CHUỒNG. CON CUỐC LẺ ĐÔI KHÓC GỌI ĐẦU TRUÔNG. 
64734,TÌNH LẶNG LẼ,56867,tình lặng,TỪ NGÀY EM ĐI ĐÀN CHIM NGỪNG HÓT MỘT NGÀY TƯƠNG TƯ...,"","NGÀY THÁNG CỨ TRÔI LẶNG LẼ TIẾNG YÊU EM CŨNG LẶNG THINH. CHỈ MONG TRONG CƠN MỘNG MƠ TA ĐƯỢC THẤY EM. HÃY NÓI LÊN ĐI NGƯỜI ƠI, MỘT TIẾNG YÊU EM LUÔN MONG CHỜ. KHI LÒNG TA GIỜ ĐÂY LUÔN CÓ NHAU. PHẬN KHÓ NẮNG MƯA BẠC GIÓ CHẲNG DÁM MƠ ĐẾN TRÈO CAO. ĐỜI ANH KHÔNG NHƯ ĐỜI EM KHÔNG THỂ SÁNH ĐÔI. TRỜI KHIẾN XUI CHI TA GẶP NHAU RỒI CÁCH LY BỞI CÂU SANG HÈN. CHO TA BAO NIỀM ĐAU KHI NHÌN NHAU. ĐÀNH CHÔN VÀO TẬN SÂU TRONG NIỀM ĐAU. BAO LỜI NÓI YÊU THƯƠNG NGỌT NGÀO. ĐỂ MONG SAO ĐỜI NHAU KHÔNG ÚA SẦU. THÀ TA ĐỪNG GẶP KHI XƯA ĐỪNG YÊU. ĐỂ ĐỪNG KHÓC CHO NHAU THẬT NHIỀU. CỐ QUÊN NHAU MÀ VẪN NGHE TIM QUẶNG ĐAU."
61418,ĐẾM NGƯỢC THỜI GIAN,59240,quay ngược thời gian,TÌNH ĐÃ LỠ GIẤC MƠ YÊU PHAI MỜ THUYỀN XƯA ĐÃ XA BẾN BỜ...,"",EM ĐÔI TA ĐÃ TỪNG YÊU. ĐÃ TỪNG MANG CHO NHAU. NHỮNG KHOẢNH KHẮC DỊU DÀNG. LÒNG ANH GHI SÂU MỘT TÌNH YÊU. DÙ GIỜ ĐI BÊN ANH KO CÒN EM NỮA. XIN CHO ANH NGƯỢC THỜI GIAN. TRỜ VỀ KHI BÊN EM. NƠI TÌNH YÊU BẮT ĐẦU. VÀ ANH VẪN SẼ LÀ CỦA EM. DÙ LÀ BIẾT MAI SAU SẼ LÀ NIỀM ĐAU. VÌ KHI ĐÃ YÊU. MONG CHO NHAU ẤM ÁP THẬT NHIỀU. DÙ KHI TÌNH ĐI. TA CÔ ĐƠN VỚI LẮM NGHĨ SUY. KHÉP ĐÔI MI LẠI GẶP EM. NGƯỜI BAO NĂM ANH TỪNG YÊU. TỪ XA XÔI VỀ LẠI. NHỮNG TIẾC NUỐI VỤNG DẠI. NẾU CHO ANH NGƯỢC THỜI GIAN. THÌ ANH VẪN NHƯ NGÀY XƯA. VẪN YÊU EM DẠI KHỜ. VẪN YÊU EM TỪNG GIỜ. 
61249,D CHỈ LÀ CHIẾC LÁ,53245,chiếc lá,EM NGHĨ RẰNG TÌNH YÊU HAI ĐỨA NHƯ MỘT CHIẾC LÁ LÁ XANH...,"",NHƯ TRONG TRONG TIA NẮNG NỤ CƯỜI LUNG LINH XOAY XOAY CHIẾC LÁ CHIỀU CUỐN RƠI CUỐN RƠI MƯA VƯƠNG TRÊN MÁI TÓC TỪNG HẠT MÙA XUÂN DỊU DÀNG DỊU DÀNG ĐẤT TRỜI THỜI GIAN DẦN TRÔI TRONG NẮNG VƯƠNG LẠI TIẾNG CƯỜI KỶ NIỆM ĐẦU TIÊN TRONG TRẮNG MANG THEO MANG THEO NGƯỜI ĐI CHIẾC LÁ ÉP TRONG TRANG VỞ ĐÃ KHÔNG CÒN MÀU XANH NỮA TIA NẮNG VẼ QUA KHE CỬA NỤ CƯỜI CÒN VẸN NGUYÊN RỒI TỪNG NGÀY THÁNG THÁNG NĂM NĂM MONG CHỜ TỪNG LỜI HẸN ƯỚC KHẮC GHI KHÔNG MỜ PHAI ĐỂ RỒI TỪNG CHIẾC LÁ RƠI RƠI TRONG CHIỀU Ở LẠI CÙNG TRANG SÁCH VẸN MÀU XANH RỒI TỪNG NGÀY THÁNG THÁNG NĂM NĂM MONG CHỜ TỪNG LỜI HẸN ƯỚC KHẮC GHI KHÔNG MỜ PHAI ĐỂ RỒI TỪNG CHIẾC LÁ RƠI RƠI TRONG CHIỀU Ở LẠI CÙNG TRANG SÁCH VẸN MÀU XANH NHƯ TRONG TRONG TIA NẮNG NỤ CƯỜI LUNG LINH XOAY XOAY CHIẾC LÁ CHIỀU CUỐN RƠI CUỐN RƠI MƯA VƯƠNG TRÊN MÁI TÓC TỪNG HẠT MÙA XUÂN DỊU DÀNG DỊU DÀNG ĐẤT TRỜI THỜI GIAN DẦN TRÔI TRONG NẮNG VƯƠNG LẠI TIẾNG CƯỜI KỶ NIỆM ĐẦU TIÊN TRONG TRẮNG MANG THEO MANG THEO NGƯỜI ĐI CHIẾC LÁ ÉP TRONG TRANG VỞ ĐÃ KHÔNG CÒN MÀU XANH NỮA TIA NẮNG VẼ QUA KHE CỬA NỤ CƯỜI CÒN VẸN NGUYÊN RỒI TỪNG NGÀY THÁNG THÁNG NĂM NĂM MONG CHỜ TỪNG LỜI HẸN ƯỚC KHẮC GHI KHÔNG MỜ PHAI ĐỂ RỒI TỪNG CHIẾC LÁ RƠI RƠI TRONG CHIỀU Ở LẠI CÙNG TRANG SÁCH VẸN MÀU XANH RỒI TỪNG NGÀY THÁNG THÁNG NĂM NĂM MONG CHỜ TỪNG LỜI HẸN ƯỚC KHẮC GHI KHÔNG MỜ PHAI ĐỂ RỒI TỪNG CHIẾC LÁ RƠI RƠI TRONG CHIỀU Ở LẠI CÙNG TRANG SÁCH VẸN MÀU XANH RỒI TỪNG NGÀY THÁNG THÁNG NĂM NĂM MONG CHỜ TỪNG LỜI HẸN ƯỚC KHẮC GHI KHÔNG MỜ PHAI ĐỂ RỒI TỪNG CHIẾC LÁ RƠI RƠI TRONG CHIỀU Ở LẠI CÙNG TRANG SÁCH VẸN MÀU XANH.
64218,SAO VỘI CHIA TAY,58929,sau chia tay,KHI EM YÊU CẤT BƯỚC RA ĐI ĐI VỀ NƠI PHƯƠNG XA CHỐN NAO...,"","RỒI MỘT MAI ĐÔI TA HẾT YÊU. RỒI EM BUÔNG TAY ANH BƯỚC ĐI . VÀ ANH ĐÂY THẬT SỰ KHÔNG CHẮC ANH GIỮ LÍ TRÍ KHÔNG ÔM EM TỪ ĐẰNG SAU. ANH NHƯ BAO NGƯỜI KHÁC THÔI, CŨNG YẾU ĐUỐI VÀ RẤT BẤP BÊNH. KHI LÒNG NÀY GIỜ ĐÃ QUEN ĐI CÙNG MỘT AI. RỒI MỘT MAI ĐÔI TA HẾT YÊU. CHẠM MẶT NHAU TRÊN CON PHỐ QUEN. HÃY XEM ANH NHƯ NGƯỜI TỪNG THƯƠNG, NHƯ NGƯỜI BẠN CŨ LÂU NĂM, HAY NGƯỜI MỘT NGƯỜI QUEN. KÍ ỨC ẤY CẤT VÀO NGĂN KHOÁ RIÊNG. QUÁ KHỨ ẤY SẼ NẰM NGỦ YÊN. GIỮA CUỘC ĐỜI DÀI ĐANG TRÔI MỆT NHOÀI. ĐỨNG HOÀI MỘT MÌNH CÔ ĐƠN CHẮC SẼ TỐT HƠN. VÀ SÁNG VẪN ĐI HỌC ĐỀU CHẠY HOÀI CHUYẾN XE. MỖI TỐI VẪN HAY NGỒI NHÀ LÀM NHIỀU MÓN ĂN. Ừ THÌ NHỮNG MÓN KHI XƯA EM THÍCH ĂN. BẬT LÊN NHỮNG THƯỚC PHIM XƯA TA HAY XEM. ĐĨA HÁT KHI XƯA TA HAY NGHE CÙNG. NHỮNG QUÁN QUEN XƯA MÌNH ĐÃ ĐI QUA. MẤT ĐI MỘT NGƯỜI YÊU THƯƠNG THẾ GIỚI CHỢT VẮNG HƠN"
63260,MỘT ĐÊM NỮA,56464,một lần nữa,ĐÊM NAY CÔ ĐƠN NGƯỚC LÊN BẦU TRỜI...,"","RỒI MỘT HÔM NHẬN RA TRÁI TIM EM GIỜ ĐÂY HẾT YÊU ANH...NÀO ĐÂU DÁM NÓI. MỘT THỜI GIAN DẦN QUA RỒI ANH CŨNG NHẬN RA,BIẾT SAO ĐÂY TRÁCH EM ĐƯỢC GÌ.. NỬ:LỜI YÊU THƯƠNG NGÀY XƯA ĐÃ TAN THEO MÀN MƯA BỞI EM KHÔNG LÀ EM HÔM TRƯỚC. NHÌN EM QUAY MẶT ĐI NGẬP NGỪNG CÂU TỪ LY SỚM MAI ĐÂY LA XA MÃI XA.... .  NGÀY MAI SẼ NHƯ GIẤC MƠ THÔI VÌ HAI ĐỨA HAI LỐI PHƯƠNG TRỜI MỘT LẦN NỮA MẤT NHAU TRONG ĐỜI. .ĐÀNH LÒNG ÔM MỘNG MƠ LỨA ĐÔI VÙI CHÔN HẾT VÀO MÂY GIÓ TRÔI NẮM TAY NHAU MỘT LẦN SAU CUỐI. NỬ:GIỌT NƯỚC MẮT EM GIẤU TRONG LÒNG VÌ EM SỐNG DÃ QUÁ MƠ MỘNG;RỒI NGÀY MAI BIẾT TA CÒN AI.  NGÀY HÔM QUA NÀO ANH DÁM TIN MỘT TÌNH YÊU ĐẸP NHƯ TRĂNG SAO.  MÀ HÔM NAY ĐÃ THEO NGÀN MÂY"
61735,EM ĐẸP NHẤT TRÊN ĐỜI,50320,em đẹp nhất đêm nay,TRẦN THẾ MUÔN ĐÓA HOA HỒNG TRẦN THẾ BAO ĐÓA TRÀ MY...,"","A HA!. ĐÊM NAY AI CŨNG CHO EM LÀ XINH NHẤT NƠI ĐÂY, À... HA! ĐẸP XINH.. A HA!. TRONG ĐÊM KHIÊU VŨ EM NHƯ VẦNG SAO SÁNG RA KHƠI, À... HA! SÁNG NGỜI.. A HA!. ĐÊM NAY EM MUỐN NGHE NHỮNG LỜI ÂN ÁI ÊM ÊM, À ... HA! ÊM ÊM.. A HA!. EM NGHE ANH NÓI YÊU EM DÀI LÂU NHÉ ANH ƠI, À ... HA! LÂU DÀI.. EM MONG CHO CHIẾC ÁO, CHIẾC ÁO TƯƠI MẦU EM ĐÃ CHỌN KỸ, MỘT CHIẾC ÁO RỰC RỠ EM VỪA THÊU.. EM MONG CHO CHIẾC ÁO ĐÓ. CŨNG NHƯ LÀ MÁI TÓC MỀM RŨ, ĐƯỢC MƠN TRỚN DƯỚI TAY NGƯỜI.. A HA!. KHI ĐÊM BUÔNG XUỐNG EM THƯỜNG HAY MƠ ƯỚC XA XÔI, À ... HA! EM MƠ.. A HA! EM MƠ EM SẼ MANG LỤA LÀ. EM XINH EM TƯƠI NHẤT ÔI NƠI TRẦN GIAN, CHO EM KHIÊU VŨ TRONG CUỘC ĐỜI TIỀN.. EM XINH EM TƯƠI EM VUI NHẤT NƠI ĐÂY.. EM XINH EM KHIÊU VŨ TRONG CUỘC ĐỜI TIÊN.. ANH CHO EM HƠI SỨC, SỨC SỐNG TRONG ĐỜI EM ĐÃ TỪNG THIẾU!. MỘT TIẾNG THÉT HẠNH PHÚC TRONG TUỔI YÊU!. ĐÊM NAY EM XIN BIẾU HẾT CÕI XUÂN NỒNG EM CHO NGƯỜI YÊU, VÀ CHO LUÔN TRÁI TIM NÀY.. A HA!. ĐÊM NAY EM MUỐN QUEN MỘT NỤ HÔN TRƯỚC TIÊN, À ... HA! NỤ HÔN.. A HA!. ĐÊM NAY EM BIẾT EM PHẢI LÀ. EM XINH EM TƯƠI NHẤT ÔI NƠI TRẦN GIAN, CHO EM KHIÊU VŨ TRONG CUỘC ĐỜI TIÊN.. EM XINH EM TƯƠI EM VUI NHẤT NƠI ĐÂY.. EM XINH EM KHIÊU VŨ TRONG CUỘC ĐỜI TIÊN.. EM XINH EM TƯƠI EM VUI NHẤT ĐÊM NAY.. EM XINH EM KHIÊU VŨ TRONG CUỘC ĐỜI TIÊN"
65223,VẪN NHẮC TÊN ANH,53203,tình anh vẫn như thế,ĐÊM NAY TỪNG HẠT MƯA RƠI PHỐ VẮNG TANH KHÔNG CÒN AI...,"","BAO YÊU THƯƠNG ANH TRAO TRAO VỀ EM EM CÓ BIẾT. CỨ MÃI HOÀI HỜN GHEN LÀM CHI NỮA. BAO YÊU THƯƠNG NĂM XƯA ANH VÙI CHÔN TRONG LÒNG MÌNH. MÀ VÌ SAO, SAO EM VẪN KHÔNG TIN?. HÔM NAY ANH YÊU EM CHO DÙ MAI SAU VẪN THẾ. ĐÃ QUÊN RỒI NGƯỜI XƯA TÌNH XƯA NĂM ẤY. CHỈ NHỚ LÚC ẤM ÁP KHI ĐỰƠC ÔM EM VÀO LÒNG. NGƯỜI YÊU ƠI, EM ƠI BIẾT HAY KHÔNG?. VẦNG TRĂNG ĐÓ SẼ MÃI THẮP SÁNG TÌNH CHÚNG TA. MỘT TÌNH YÊU KHÔNG THỂ PHAI NHOÀ. VÀ TÌNH YÊU ANH SẼ, TRAO NGƯỜI MÃI MÃI. MÀ VÌ SAO EM HỜN GHEN?. TÌNH YÊU ĐÓ SẼ MÃI THẮP SÁNG CẢ KHÔNG GIAN. DÙ NGÀN ĐỜI KHÓ PHAI!. ANH LUÔN BÊN EM TRONG NHỮNG KHI EM MUỘN PHIỀN. VÌ NGƯỜI ANH YÊU LÀ EM, ƠI NGƯỜI ƠI!"
66491,TÌNH KỸ NỮ,50488,tình,TỨ LANG ƠI... TRĂNG KHUYA NẶNG HẠT ƯỚT VAI RỒI...,"","TÌNH LÀ MỘT CHUYỆN MUÔN MÀU, TÌNH LÀ MÌNH THÀNH VUI THẬT MAU. TÌNH LÀ MỘT BÀI THƠ SẦU, TÌNH LÀ MÌNH THẦM NHỚ THƯƠNG NHAU. TÌNH ĐẸP MÙA THU VÀNG, TÌNH MÌNH NHIỀU MỘNG ƯỚC MÊNH MANG . TÌNH LÀ MỘT CHUYỆN HUY HOÀNG, TÌNH LÀ MÌNH THÀNH NHỚ HOANG MANG. YÊU NHAU KHI XUÂN TƯƠI SÁNG, YÊU NHAU TRONG TIẾNG CA TIẾNG ĐÀN. YÊU NHAU TRONG MUÔN TIA NẮNG, YÊU NHAU TRONG ÁNH TRĂNG MƠ MÀNG. YÊU NHAU KHI SƯƠNG THU RƠI, YÊU NHAU KHI HOA LÁ XANH TƯƠI . YÊU NHAU KHI MƯA ĐÔNG RƠI, YÊU NHAU YÊU NHAU MÃI SUỐT ĐỜI...."
64705,TÌNH HÈ,60069,tình hè,CHỢT NGHE TRÊN MI VÀNG MÙA HẠ NIỀM TIN ĐANG CÔ ĐỌNG...,"",HÈ SANG TIẾNG VE U SẦU. HÈ MANG TIA NẮNG CHAN HÒA. NGÀN HOA PHƯỢNG TƯƠI THẮM MÀU. CHO TA HỒN THI NHÂN. NGƯỜI CÓ NHỚ TIẾNG VE NĂM NÀO. NGƯỜI CÓ NHỚ ĐÓA HOA SÂN TRƯỜNG.. MÀU XANH BIẾC SUỐI TRÔI. LƯNG TRỜI MÂY BAY ÔI NÊN THƠ. HÈ SANG BÓNG XƯA XA DẦN. LÒNG TA BỖNG DƯNG SAO BUỒN. NHÌN MÂY TRÔI QUA LỮNG LỜ. MANG THEO TÌNH CÔ ĐƠN.. HÈ MANG ĐẾN TIẾNG VE U SẦU. HÈ SANG SUỐI MƠ VẪN CÒN. TÌNH YÊU VÚT CÁNH BAY THEO MÂY. CÒN ĐÂU PHÚT GẦN NHAU.. HÈ SANG XÓT XA VÔ VÀN. CÒN ĐÂU YÊU ĐƯƠNG MẶN NỒNG. TÌNH YÊU TA SAO LỠ LÀNG. NAY TA ĐÀNH XA NHAU. TÌNH TA ĐÃ BAY THEO GIÓ HÈ. CÒN ĐÂU ƯỚC MƠ BAN ĐẦU. TÌNH YÊU ĐÃ BỎ TA RA ĐI. LÒNG ĐAU XÓT TÌNH YÊU. NGƯỜI CÓ NHỚ TIẾNG VE NĂM NÀO. NGƯỜI CÓ NHỚ ĐÓA HOA NĂM NÀO. TÌNH YÊU CŨ ĐÃ XA TA RỒI. SAO LÒNG VẪN BUỒN ĐAU..
62285,HOÀNG LAN NG HOÀNG LANDƯỚI B ,51173,hương ngọc lan,BÓNG CÂY HOÀNG LAN NHỮNG ĐÊM BÂNG KHUÂNG...,"","GÓC PHỐ NƠI ANH HẸN CÀNH NGỌC LAN XÒA BÓNG MÁT TOẢ HƯƠNG BÁT NGÁT BÁO VỚI EM NGÀY CUỐI THU BUỒN CHỜ ANH BAO LÂU TRÔNG MONG MỎI MÒN MÀ CHẲNG THẤY ANH TỪ NGÀY NÀO ANH MỚI QUEN EM VẪN CÂY NGỌC LAN XOÀ BÓNG MÁT VÀ VẪN HƯƠNG THƠM NƠI TA ĐÃ HẸN MỘT NHÀNH LAN ANH HÁI CHO EM ĐỂ MÃI LÀ MỘT CHÚT HƯƠNG NGÀY CUỐI THU SẼ MÃI MÃI YÊU ANH LÀ THẾ SẼ MÃI MÃI HƯƠNG NGỌC LAN CÒN CÒN TRONG GIẤC MƠ SẼ MÃI MÃI YÊU ANH LÀ THẾ SẼ MÃI MÃI VÌ TRÁI TIM EM ĐÃ TRAO GỬI ANH TÌNH NỒNG NHƯ THOÁNG HƯƠNG NGỌC LAN DỊU DÀNG HƯƠNG LAN BAY XA MỘT TRƯA CUỐI THU THƯƠNG ANH YÊU ANH GÓC PHỐ NƠI HẸN HÒ MÙI LAN THƠM NGÁT CÙNG GIÓ SẼ TIẾC MÃI NẾU BIẾT LÚC CHỚM ĐÔNG HOA THƠM LỤI TÀN ĐỂ GIÓ MÃI CUỐN ĐI ĐỂ MÃI BÂNG KHUÂNG, BÂNG KHUÂNG NƠI ANH HẸN VỚI EM"
62875,MÃI LÀ NIỀM ĐAU,51351,mãi là niềm đau,EM MÃI LÀ NIỀM VUI NIỀM VUI CỦA MỌI NGƯỜI...,"",ANH MÃI LÀ NIỀM VUI NIỀM VUI CHO MỌI NGƯỜI ANH MÃI LÀ NIỀM ĐAU NIỀM ĐAU CHO MỘT NGƯỜI TÌNH YÊU VỪA THOÁNG QUA ĐÂY BUỒN NHƯ MÀU ÁO EM BAY MỘT PHÚT ANH VUI BÊN NGƯỜI TỪNG BƯỚC CÔ ĐƠN EM VỀ LÀ BIẾT XA NHAU TỪ ĐẤY ANH MÃI LÀ MÙA XUÂN MÙA XUÂN CHO CUỘC ĐỜI ANH MÃI LÀ MÙA ĐÔNG MÙA ĐÔNG CHO MỘT NGƯỜI CHIỀU NAY NGỒI NGẮM MÂY TRÔI TÌM ĐÂU MÀU MẮT THƠ NGÂY NHÌN CÁNH CHIM BAY QUA TRỜI NHÌN PHÚT ANH TRONG TAY NGƯỜI MÃI MÃI LÀ NIỀM ĐAU MÃI MÃI LÀ NIỀM ĐAU NGÀY EM ĐÃ BƯỚC QUA NHỊP CẦU CUỘC ĐỜI TA ƯỚC MƠ LẦN ĐẦU GIỜ NHÌN ANH VẪY CHÀO RA ĐI MÃI MÃI LÀ NIỀM ĐAU NGÀY ANH ĐÃ LÃNG QUÊN TÌNH ĐẦU VÀ ĐƯỜNG XƯA VẪN XANH MỘT MÀU CHỈ MÌNH TA CÚI ĐẦU RA ĐI ANH MÃI CÒN TÌM VUI TÌM VUI TRONG CUỘC ĐỜI ANH GỬI LẠI NIỀM ĐAU NIỀM ĐAU CHO MỘT NGƯỜI NGÀY MAI NGỒI ĐẾM SAO RƠI VÌ SAO NHỎ BÉ TRONG TÔI NHÌN NHỮNG GIẤC MƠ QUA RỒI NHÌN PHÚT ANH VUI BÊN NGƯỜI MÃI MÃI LÀ NIỀM ĐAU MÃI MÃI LÀ NIỀM ĐAU NGÀY EM ĐÃ BƯỚC QUA NHỊP CẦU CUỘC ĐỜI TA ƯỚC MƠ LẦN ĐẦU GIỜ NHÌN ANH VẪY CHÀO RA ĐI MÃI MÃI LÀ NIỀM ĐAU NGÀY ANH ĐÃ LÃNG QUÊN TÌNH ĐẦU VÀ ĐƯỜNG XƯA VẪN XANH MỘT MÀU CHỈ MÌNH TA CÚI ĐẦU RA ĐI.
63337,NẾU NGÀY MAI,58530,ngày mai sau nếu,NẾU NGÀY MAI MÌNH KHÔNG CÒN NHAU CHẮC EM CŨNG...,"","NHƯ LÀ CƠN GIÓ EM KHẼ ĐẾN BÊN ANH NHƯ LÀ TIA NẮNG SƯỞI ẤM BAO HY VỌNG CHỢT TAN VÀO BÓNG TỐI ANH BƠ VƠ LẺ LOI KHI MÀN ĐÊM PHỦ LẤY ĐỜI ANH. GIỜ EM VỀ NƠI ĐÓ CHẮC SẼ CÓ YÊU THƯƠNG GIỜ EM VỀ NƠI ĐÓ LUÔN CÓ AI BÊN CẠNH VẬY THÔI ĐÀNH QUÊN HẾT QUÁ KHỨ XÓA ĐI BAO NHIÊU KỈ NIỆM GIỜ ĐÀNH QUÊN.  NGÀY MAI SAU NẾU CÓ GẶP NHAU THÌ XIN HÃY QUÊN, XIN ĐỪNG TÌM LẠI K Ỉ NIỆM XƯA ĐÓ ĐÃ TÀN PHAI ĐÃ KHÔNG CÒN AI TRÊN CON ĐƯỜNG. MỘT MÌNH ANH LÊ BƯỚC, BIẾT VỀ ĐÂU NGÀN CÂU YÊU THƯƠNG BÂY GIỜ ĐÀNH VÙI TRONG LÃNG QUÊN. NGÀY MAI SAU NẾU... CÓ GẶP NHAU XIN HÃY QUÊN... XIN ĐỪNG TÌM LẠI YÊU DẤU ĐÃ TÀN PHAI ĐÃ KHÔNG CÒN AI TRÊN CON ĐƯỜNG MỘT MÌNH ANH LÊ BƯỚC... VỀ ĐÂU NGÀN CÂU YÊU THƯƠNG BÂY GIỜ ĐÀNH VÙI TRONG LÃNG QUÊN."
65178,TRẢ LỜI ANH ĐI,58196,trả lại anh,MÌNH ĐÀNH CHIA TAY VÌ NGÀY HÔM NAY VÔ TÌNH...,"",NƠI TA TỪNG QUA QUÁN QUEN TA TỪNG NGỒI BAO NHIÊU BUỒN VUI DƯỜNG NHƯ VẪN CÒN ĐÓ NHƯNG ANH ĐÃ XA ĐÃ QUÊN MẤT EM RỒI MANG ĐI CỦA EM NHỮNG NỤ CƯỜI KHI TA GẶP NHAU CÓ HAY ĐÂU MỘT NGÀY EM MANG NIỀM ĐAU VÌ YÊU ANH NHIỀU QUÁ XIN ANH TRẢ EM NHỮNG NĂM THÁNG ÊM ĐỀM NHỮNG NGÀY MÀ ANH CHƯA TỪNG ĐẾN TRẢ LẠI CHO ANH BAO CÂU NÓI VUI TRẢ LẠI CHO ANH CƠN MƯA CÓ ĐÔI TRẢ LẠI CHO ANH BAO NHIÊU LỜI HỨA Ở TRÊN ĐẦU MÔI CHUYỆN TÌNH MÌNH CHỈ THẾ THÔI THÀ RẰNG EM SỐNG LẺ LOI HƠN LÀ EM BÊN MỘT NGƯỜI NHIỀU GIAN DỐI TRẢ LẠI CHO EM YÊN VUI TRƯỚC ĐÂY NGÀY MÌNH CHƯA YÊU EM CHƯA ĐẮNG CAY TRẢ LẠI CHO EM CON TIM MẠNH MẼ ĐỂ ĐI TIẾP NGÀY MAI ĐOẠN ĐƯỜNG DÀI SẼ VẮNG ANH GƯỢNG CƯỜI EM NÓI VỚI EM RỒI NGÀY MAI SẼ TỐT HƠN BÂY GIỜ NƠI TA TỪNG QUA QUÁN QUEN TA TỪNG NGỒI BAO NHIÊU BUỒN VUI DƯỜNG NHƯ VẪN CÒN ĐÓ NHƯNG ANH ĐÃ XA ĐÃ QUÊN MẤT EM RỒI MANG ĐI CỦA EM NHỮNG NỤ CƯỜI KHI TA GẶP NHAU CÓ HAY ĐÂU MỘT NGÀY EM MANG NIỀM ĐAU VÌ YÊU ANH NHIỀU QUÁ XIN ANH TRẢ EM NHỮNG NĂM THÁNG ÊM ĐỀM NHỮNG NGÀY MÀ ANH CHƯA TỪNG ĐẾN TRẢ LẠI CHO ANH BAO CÂU NÓI VUI TRẢ LẠI CHO ANH CƠN MƯA CÓ ĐÔI TRẢ LẠI CHO ANH BAO NHIÊU LỜI HỨA Ở TRÊN ĐẦU MÔI CHUYỆN TÌNH MÌNH CHỈ THẾ THÔI THÀ RẰNG EM SỐNG LẺ LOI HƠN LÀ EM BÊN MỘT NGƯỜI NHIỀU GIAN DỐI TRẢ LẠI CHO EM YÊN VUI TRƯỚC ĐÂY NGÀY MÌNH CHƯA YÊU EM CHƯA ĐẮNG CAY TRẢ LẠI CHO EM CON TIM MẠNH MẼ ĐỂ ĐI TIẾP NGÀY MAI ĐOẠN ĐƯỜNG DÀI SẼ VẮNG ANH GƯỢNG CƯỜI EM NÓI VỚI EM RỒI NGÀY MAI SẼ TỐT HƠN BÂY GIỜ TRẢ LẠI CHO ANH BAO CÂU NÓI VUI TRẢ LẠI CHO ANH CƠN MƯA CÓ ĐÔI TRẢ LẠI CHO ANH BAO NHIÊU LỜI HỨA Ở TRÊN ĐẦU MÔI CHUYỆN TÌNH MÌNH CHỈ THẾ THÔI THÀ RẰNG EM SỐNG LẺ LOI HƠN LÀ EM BÊN MỘT NGƯỜI NHIỀU GIAN DỐI TRẢ LẠI CHO EM YÊN VUI TRƯỚC ĐÂY NGÀY MÌNH CHƯA YÊU EM CHƯA ĐẮNG CAY TRẢ LẠI CHO EM CON TIM MẠNH MẼ ĐỂ ĐI TIẾP NGÀY MAI ĐOẠN ĐƯỜNG DÀI SẼ VẮNG ANH GƯỢNG CƯỜI EM NÓI VỚI EM RỒI NGÀY MAI SẼ TỐT HƠN BÂY GIỜ RỒI NGÀY MAI SẼ TỐT HƠN BÂY GIỜ.
61752,EM KHÔNG BUỒN NHƯNG SẼ KHÓC VÌ ANH,57304,em sẽ không buồn,NHỚ LÚC TRƯỚC NGƯỜI ĐÃ Ở BÊN TÔI MÀ GIỜ ĐÂY ĐỔI THAY...,"",YÊU NHIỀU SẼ MẤT NHAU. CÂU NHÂN GIAN EM VẪN THƯỜNG NGHE. YÊU NHIỀU SẼ ĐỚN ĐAU. ƠI ANH YÊU ANH ƠI THẾ PHẢI KHÔNG ?. CỚ SAO NGÀY THÁNG QUA. ANH LUÔN MƠ HOANG HỠI NGƯỜI ƠI ?. KHÔNG CÒN LỜI DẤU YÊU. ANH NHƯ CÂY KHÔ GIỮA MÙA ĐÔNG. NHƯ KẺ VÔ HỒN. HÃY YÊU BẰNG TRÁI TIM ANH ƠI. HÃY YÊU BẰNG CHÍNH ANH YÊU ƠI. HÃY YÊU BẰNG NHỮNG CÂU YÊU THƯƠNG. THÀ ANH NÓI CHỈ CÓ THẾ CHÚNG TA SẼ KHÔNG BAO LÂU. YÊU THƯƠNG VU VƠ CHỨ ANH CHẲNG YÊU EM ĐÂU. HÃY NÓI ĐI .... CHỚ CÓ MỘNG MƠ TRONG TIM ANH. KHÔNG HỀ KHẮC GHI TÊN EM. KHÔNG YÊU KHÔNG THƯƠNG ANH CHỈ THOÁNG VUI BÊN EM. HÃY NÓI ĐI. EM SẼ KHÔNG BUỒN. ANH ƠI XIN ANH NÓI THẬT ĐI. SẼ MÃI KHÔNG BUỒN
63075,MỘT NGÀY GIÁ BĂNG,56936,băng giá,MỖI KHI CÙNG GIÓ ĐÔNG VỀ THẤY BAO NHIÊU KỶ NIỆM...,"","MỘT TÌNH YÊU XÓT XA QUÁ, CHỈ LÀ CAY ĐẮNG DỐI TRÁ, ĐỂ RỒI TIM HOÁ BĂNG GIÁ, LẠNH LÙNG NHƯ NHỮNG SỎI ĐÁ... MUỐN QUÊN BAO THÁNG NGÀY, ĐỂ CƠN ĐAU LẤP ĐẦY, ĐỂ THẬT SỰ ĐỐT CHÁY, HẾT ĐI VẤN VƯƠNG TRÁI TIM NÀY... . XIN ANH, ANH ĐI VỀ ĐI, TÌNH MÌNH CÒN ĐẦY VẤN NGHI, NÊN THÔI, ĐÔI TA BIỆT LY... (EM GIỜ NƠI ĐÂU, MONG CHỜ EM TỪNG ĐÊM THÂU...) ĐỪNG NÓI CHI MỘT CÂU, THÊM BUỒN ĐAU, TRONG LÒNG NHAU. ĐẾN KHI TÌNH TA, BAO NGÀY QUA, ĐÃ RỜI XA. HÃY LAU BỜ MI, QUAY VỀ ĐI, KHÔNG CÒN CHI... (SAO VẬY EM ĐÀNH RA ĐI, CHO TÌNH TA PHẢI CHIA LI...). . XOÁ HẾT BAO THÁNG NĂM ẤM NỒNG, XÉ HẾT BAO THƯ TÌNH MÙA ĐÔNG, ĐỐT HẾT BAO HI VỌNG CHỜ TRÔNG, CHỈ VÌ, TUYỆT VỌNG ANH BIẾT KHÔNG... NUỐI TIẾC CHO BIẾT BAO MƠ MỘNG, NÍU KÉO NHAU CHI CHỈ HOÀI CÔNG, CHẤM HẾT YÊU THƯƠNG NÀY LÀ XONG, TỪ GIỜ, KHÔNG NHỚ KHÔNG CHỜ MONG.... "
64789,TÌNH TA LÝ QUA CẦU,51680,tình ta lý qua cầu,ANH Ở BÊN NÀY CẦU HÁT LỜI THƯƠNG MẾN...,"",ANH Ở BÊN NAY CẦU HÁT LỜI THƯƠNG MẾN EM Ở BÊN KIA CẦU CUỐI BẾN CHỜ MONG QUA CẦU BÀI LÝ ĐONG ĐƯA NHƯ NẮNG BAN TRƯA NHƯ MƯA CHIỀU ĐẾN ANH Ở BÊN NAY CẦU NÓI LỜI HẸN ƯỚC EM Ở BÊN KIA CẦU BẾN NƯỚC THỦY CHUNG ƯỚC GÌ ĐỪNG CÓ DÒNG SÔNG ĐỂ KHÔNG CHÍN ĐỢI MƯỜI MONG MỘT NGƯỜI Ơ CẦU VÁN RUNG RINH Ơ CẦU TRE LẮT LẺO NƯỚC CON SÔNG DÀI NƯỚC CHIA MẤY NẺO DỨT ÁO EM VỀ KẺO TÍA MÁ ĐỢI TRÔNG Ơ CẦU VÁN TÌNH ANH Ơ CẦU TRE TÌNH EM THUI THỦI NƠI ĐÂY CẦU ĐỨNG MỘT MÌNH CÒN AI LẮT LẺO LẮT LẺO ĐƯA TÌNH QUA SÔNG ANH Ở BÊN NAY CẦU HÁT LỜI THƯƠNG MẾN EM Ở BÊN KIA CẦU CUỐI BẾN CHỜ MONG QUA CẦU BÀI LÝ ĐONG ĐƯA NHƯ NẮNG BAN TRƯA NHƯ MƯA CHIỀU ĐẾN ANH Ở BÊN NAY CẦU NÓI LỜI HẸN ƯỚC EM Ở BÊN KIA CẦU BẾN NƯỚC THỦY CHUNG ƯỚC GÌ ĐỪNG CÓ DÒNG SÔNG ĐỂ KHÔNG CHÍN ĐỢI MƯỜI MONG MỘT NGƯỜI Ơ CẦU VÁN RUNG RINH Ơ CẦU TRE LẮT LẺO NƯỚC CON SÔNG DÀI NƯỚC CHIA MẤY NẺO DỨT ÁO EM VỀ KẺO TÍA MÁ ĐỢI TRÔNG Ơ CẦU VÁN TÌNH ANH Ơ CẦU TRE TÌNH EM THUI THỦI NƠI ĐÂY CẦU ĐỨNG MỘT MÌNH CÒN AI LẮT LẺO ĐƯA TÌNH QUA SÔNG.
64876,TÌNH YÊU TRÊN NET,53960,tình yêu,NGỒI BUỒN TA LÊN NET TA VÀ EM QUEN NHAU LẦN ĐẦU...,"","TÌNH YÊU LÀ ĐÓA HOA. TÌNH YÊU LÀ NẮNG MAI. TÌNH SÁNG NHƯ MẶT TRỜI. CUỘC SỐNG LÀ TÌNH YÊU. TÌNH YÊU LÀ THÚ VUI. TÌNH YÊU LÀ NỖI LO. TÌNH CHẾT TRONG LÒNG MÌNH. CHẲNG MẤY AI ĐƯỢC YÊU. TÌNH YÊU MẤT , CUỘC SỐNG ÔI BAO MUỘN PHIỀN. TÌM KIẾM NHAU ... RỒI LẠI MẤT NHAU. NGÀY NÀO ĐÓ , TÌM THẤY NỬA KIA CUỘC ĐỜI. GÌN GIỮ ĐI , VÌ HIẾM KHI .... YÊU 1 NGƯỜI , NGUYỆN HI SINH TRỌN CUỘC ĐỜI. VÌ KHI KHÔNG YÊU ĐƯỢC RỒI CHẲNG CÒN THIẾT THA. YÊU MỘT NGƯỜI LÀ CÓ THÊM NHIỀU NỤ CƯỜI. VẬY YÊU ĐI THÔI , YÊU KHÔNG CẦN TOAN TÍNH ..."
63557,NGƯỜI MAY MẮN,51935,người mẹ,NGÀY XƯA EM YÊU TÔI THƯƠNG TÔI EM ĐÃ YÊU TRÊN ĐẦU MÔI...,"",TÔI MUỐN LÀ HẠT NẮNG ĐỂ ĐẾN BÊN MẸ. ƯƠM LÊN SỢI TÓC ĐỂ TÓC SÁNG LONG LÁNH. TÔI MUÔN LÀM NGỌN GIÓ ĐỂ ĐẾN ÔM MẸ. HÔN LÊN ĐÔI MẮT HẰN SÂU DẤU CHÂN CHIM. SỢI TÓC MÀU MÂY TRẮNG KỂ TÔI NGHE. NGÀY XƯA MẸ TRUYỀN CƠM QUA VÁCH CỐC. VƯỢT QUA NGÀN SONG GIÓ MẸ VẪN UNG DUNG. LÒNG THỦY CHUNG MẸ VIỆT NAM SÁNG NGỜI
64854,TÌNH YÊU LÀ THẾ,50706,tình yêu là thế,CÒN ĐÂU NỮA MÙA THU NGHE LÁ RƠI CÓ ÁNH TRĂNG...,"","TÌNH YÊU LÀ ÁNH NẮNG ĐEM MẠCH SỐNG XUÂN CHO ĐỜI TÌNH YÊU LÀ TIẾNG SÉT RUNG ĐỘNG NGẤT NGÂY TUYỆT VỜI TỰA NHƯ DÒNG SUỐI MÁT VỖ VỀ AN ỦI LÒNG TA NHỮNG CHIỀU MỎI GỐI ĐƯỜNG XA KHUNG TRỜI NỞ THÔNG ĐẦY HOA TÌNH YÊU LÀ TRÁI CẤM LỐI VỀ CÁCH CHIA THIÊN ĐÀNG TÌNH YÊU LÀ TIẾNG HÁT ĐƯA HỒN LÃNG DU MÂY NGÀN TÌNH YÊU LÀ NƯỚC MẮT CHIA ĐỜI ĐÔI NGẢ LÌA TAN, MỎI MÒN ĐÊM VẮNG THỞ THAN ĐƯỜNG TÌNH YÊU NHIỀU HOA DỐI GIAN ĐƯỜNG TRẦN NHIỀU CHÔNG CHONG GAI SƠM CHIỀU TIẾC RẺ THƠ NGÂY RƯỢU NỒNG CÀNG MÊ SAY ĐỂ RỒI CHUỐC LẤY CHUA CAY KỶ NIỆM CÀNG NUỐI TIẾC SUỐT ĐỜI KHÓC GIÓ THƯƠNG MÂY LỜI THỀ NGUYỀN GẮN BÓ CHỈ CÒN LÀ MỘT TRANG GIẤY TÌNH YÊU LÀ THẾ ĐÓ KHIẾN NGƯỜI ƯỚC MƠ THẬT NHIỀU NGỜ ĐÂU LÀ BÃO TỐ GÂY SỤP ĐỖ GÂY TIÊU ĐIỀU TÌNH YÊU LÀ LỬA CHÁY MUÔN ĐỜI NAO NỨC TRIỆU CON TIM THẾ GIAN NÀY HOANG PHẾ QUẠNH HIU NẾU NHÂN LOẠI KHÔNG CÓ TÌNH YÊU"
